{
  "schema_version": "0.1.0",
  "artifact_type": "research_finding_record",
  "record_id": "LCMRP-FINDREC-9999-SYNTHETIC-TAXONOMY-NOT-RUN",
  "record_version": 1,
  "immutable_record_notice": "Once published, this finding record is immutable. Corrections, reinterpretations, retractions, or new dispositions require a new record version linked to the superseded raw-byte digest.",
  "amendment": {
    "kind": "INITIAL",
    "supersedes_record_version": null,
    "supersedes_artifact_digest": null,
    "rationale": null,
    "changed_fields": []
  },
  "record_status": "DRAFT",
  "finding_id": "LCMRP-FIND-9999-SYNTHETIC-TAXONOMY-NOT-RUN",
  "research_layer": "LAYER_1_FOUNDATIONAL_RESEARCH",
  "study_reference": {
    "study_id": "LCMRP-FSTUDY-9999-SYNTHETIC-MEMORY-TAXONOMY",
    "study_record_id": "LCMRP-FSTUDYREC-9999-SYNTHETIC-MEMORY-TAXONOMY",
    "study_record_version": 1,
    "manifest_artifact": {
      "artifact_id": "ARTIFACT-SYNTHETIC-FOUNDATIONAL-STUDY-MANIFEST",
      "artifact_version": 1,
      "schema_id": "urn:lcmrp:schema:foundational-study-manifest:0.1.0",
      "locator": "examples/foundational-study-manifest.example.json",
      "digest": {
        "algorithm": "SHA-256",
        "status": "RECORDED",
        "value": "ee9f97abc54596e77ef6c893ae5dbcd03edaf4561f28c2bf992612070d673753",
        "scope": "RAW_FILE_BYTES"
      },
      "media_type": "application/json"
    }
  },
  "subject_reference": {
    "target_type": "FOUNDATIONAL_SUBJECT",
    "subject_kind": "MEMORY_TAXONOMY",
    "subject_id": "LCMRP-FSUBJ-9999-SYNTHETIC-MEMORY-TAXONOMY",
    "subject_series": "LCMRP-SYNTHETIC-MEMORY-TAXONOMY",
    "subject_version": 1,
    "definition_artifact": {
      "artifact_id": "ARTIFACT-SYNTHETIC-SUBJECT-BINDING",
      "artifact_version": 1,
      "schema_id": "urn:lcmrp:schema:foundational-study-manifest:0.1.0",
      "locator": "examples/foundational-study-manifest.example.json",
      "digest": {
        "algorithm": "SHA-256",
        "status": "RECORDED",
        "value": "ee9f97abc54596e77ef6c893ae5dbcd03edaf4561f28c2bf992612070d673753",
        "scope": "RAW_FILE_BYTES"
      },
      "media_type": "application/json"
    }
  },
  "primary_method_profile_reference": {
    "profile_kind": "STRUCTURAL_OR_TAXONOMY_EVALUATION",
    "profile_id": "LCMRP-MPROF-9999-STRUCTURAL-TAXONOMY",
    "profile_series": "LCMRP-METHOD-PROFILE-STRUCTURAL-TAXONOMY",
    "profile_version": 1,
    "profile_artifact": {
      "artifact_id": "ARTIFACT-SYNTHETIC-PROFILE-BINDING",
      "artifact_version": 1,
      "schema_id": "urn:lcmrp:schema:foundational-study-manifest:0.1.0",
      "locator": "examples/foundational-study-manifest.example.json",
      "digest": {
        "algorithm": "SHA-256",
        "status": "RECORDED",
        "value": "ee9f97abc54596e77ef6c893ae5dbcd03edaf4561f28c2bf992612070d673753",
        "scope": "RAW_FILE_BYTES"
      },
      "media_type": "application/json"
    }
  },
  "analysis_reference": {
    "analysis_id": "ANALYSIS-STRUCTURAL-CONFORMANCE",
    "analysis_mode": "CONFIRMATORY"
  },
  "claim": {
    "claim_id": "CLAIM-SYNTHETIC-STRUCTURAL-CONFORMANCE",
    "statement": "The synthetic taxonomy satisfies its declared structural competency question and integrity constraint on the planned fixtures.",
    "scope": "Only the exact synthetic subject, study manifest, analysis, profile, definitions, and fixture plan referenced by this record."
  },
  "terminal_disposition": "NOT_RUN",
  "result_classification": "NOT_OBSERVED",
  "claim_assessment": "NOT_ASSESSED",
  "result_assessment_orthogonality_notice": "Result classification and claim assessment are independent fields. A POSITIVE, NEGATIVE, NULL, or MIXED result does not determine whether the scoped claim is supported.",
  "finding_statement": "The synthetic analysis was intentionally not executed; this fixture demonstrates retention of an explicit NOT_RUN disposition.",
  "uncertainty": "No observation exists, so effect or conformance uncertainty cannot be estimated.",
  "raw_output_artifacts": [],
  "deviations": [],
  "failures": [
    "No execution was attempted because this is a non-evidentiary contract fixture."
  ],
  "limitations": [
    "This draft synthetic disposition is not an empirical result and cannot support the scoped claim.",
    "The referenced foundational study is itself a draft fixture with planned artifacts."
  ],
  "mechanism_maturity_effect": {
    "applicability": "NOT_APPLICABLE",
    "mechanism_under_evaluation": false,
    "may_award_mechanism_evidence_labels": false,
    "may_change_mechanism_evidence_profile": false,
    "awarded_mechanism_evidence_labels": [],
    "rationale": "A foundational taxonomy disposition is not a mechanism evidence-state decision."
  },
  "recommended_next_step": "Freeze a real foundational-study protocol and its exact subject, profile, sources, and analysis artifacts before executing any study.",
  "created_at": "2026-07-21T00:00:00Z"
}
